{
  "version": "1.0.0",
  "naming": {
    "entities": "PascalCase",
    "services": "{Name}Service",
    "repositories": "{Entity}Repository",
    "controllers": "{Domain}Controller",
    "components": "kebab-case",
    "commands": "kebab-case.md",
    "skills": "kebab-case/SKILL.md",
    "agents": "kebab-case.md"
  },
  "structure": {
    "src_location": "src/",
    "tests_location": "src/scripts/",
    "test_suffix": "test_",
    "test_pattern": "test_{name}",
    "commands_location": "src/commands/",
    "skills_location": "src/skills/",
    "agents_location": "src/agents/",
    "hooks_location": "src/hooks/"
  },
  "code_style": {
    "max_line_length": 120,
    "indent": "spaces",
    "indent_size": 4,
    "quotes": "double",
    "semicolons": false,
    "trailing_comma": "none"
  },
  "detected_at": "2025-12-16T12:00:00Z",
  "manual_overrides": []
}
